Speaker Name,Email Address,Email Sent Date,Email Sent Time (PT),Language Type,Response Received,Response Date,Confirmed Attendance,Notes
Dr. Jan Born,jan.born@uni-tuebingen.de,May 28 2026,~10:33 AM,Non-Conditional,Pending,TBD,Pending,Active systems consolidation focus
Dr. Ken Paller,k-paller@northwestern.edu,May 28 2026,~10:35 AM,Non-Conditional,Pending,TBD,Pending,Targeted memory reactivation focus
Dr. Robert Stickgold,rstickgold@hms.harvard.edu,May 28 2026,~10:40 AM,Conditional,Pending,TBD,Pending,Sleep and consolidation focus
Dr. Matt Wilson,mwilson@mit.edu,May 28 2026,~10:43 AM,Conditional,Pending,TBD,Pending,Memory replay and cellular mechanisms
David Chalmers,d.chalmers@nyu.edu,May 28 2026,~10:46 AM,Conditional,Pending,TBD,Pending,Philosophy of consciousness and identity
Dr. Stuart Russell,russell@cs.berkeley.edu,May 28 2026,~10:47 AM,Conditional,Pending,TBD,Pending,AI safety and alignment focus
